{
  "video_duration_seconds": 1317,
  "title": "One Deceiver Is Hiding Here Part 5",
  "hashtags": [
    "#rickandmorty",
    "#totalrickall",
    "#adultanimation",
    "#scificomedy",
    "#parasite",
    "#fakememories",
    "#cliffhanger"
  ],
  "youtube_tags": [
    "rick and morty",
    "rick and morty total rickall",
    "rick memory parasite",
    "jerry and sleepy gary",
    "fake memories",
    "alien parasites",
    "one deceiver",
    "rick and morty clip",
    "adult animation",
    "sci fi comedy",
    "mystery cartoon",
    "part 5 series"
  ],
  "series": {
    "series_id": "parasitic",
    "part": 5,
    "start_seconds": 593,
    "end_seconds": 788,
    "is_final": false,
    "summary": "Rick tests Jerry's memories, but their shared vacation only deepens the suspicion that one parasite is manipulating the house."
  },
  "cuts": [
    {
      "start_seconds": 593,
      "end_seconds": 619,
      "voiceover_text": "The room remembers Rick doing something he swears he never did. He returns with a money-making plan, but insists he never pulled it. The contradiction rattles everyone."
    },
    {
      "start_seconds": 635,
      "end_seconds": 717,
      "voiceover_text": "Then Jerry's memories are packed with friendship, so Rick tests the one thing that still feels real: a shared vacation. On a boat, Jerry and Sleepy Gary drink, laugh, and kiss. For one moment, their connection feels undeniable."
    },
    {
      "start_seconds": 719,
      "end_seconds": 788,
      "voiceover_text": "But the reassurance collapses. People are desperate to escape, and Rick feels a parasite fighting inside his head. The crowd answers with memories of Rick. One deceiver may be turning them against each other, and Rick cannot prove it is not him."
    }
  ],
  "target_total_duration_seconds": 30
}