{
"video_duration_seconds": 1289,
"title": "Morty Defeats Scorpions to Pass Bechdel Test",
"hashtags": [
"#rickandmorty",
"#bechdeltest",
"#storytrain",
"#rickc137",
"#adultswim",
"#animation",
"#scifi"
],
"youtube_tags": [
"rick and morty",
"bechdel test",
"story train",
"morty story",
"beth and summer",
"female scorpions",
"heavy special time",
"never ricking morty",
"anthology train",
"adult swim",
"rick sanchez",
"morty smith"
],
"cuts": [
{
"start_seconds": 638,
"end_seconds": 648,
"voiceover_text": "Trapped inside the story train, Rick desperately demands a narrative that passes the Bechdel test. Two named women must talk about anything other than a man.",
"keywords": [
{
"word": "Trapped",
"color": "#E63946"
},
{
"word": "desperately",
"color": "#F77F00"
},
{
"word": "Bechdel",
"color": "#00B4D8"
},
{
"word": "women",
"color": "#7209B7"
}
]
},
{
"start_seconds": 656,
"end_seconds": 680,
"voiceover_text": "Morty panics and crafts an absurdly awkward tale starring his mother Beth and sister Summer. Drinking warm tea, Summer nervously asks about her special time. Beth reassures her that her heavy cycle is a source of pure strength, validating their bond.",
"keywords": [
{
"word": "panics",
"color": "#D90429"
},
{
"word": "awkward",
"color": "#FFB703"
},
{
"word": "Summer",
"color": "#4CC9F0"
},
{
"word": "strength",
"color": "#06D6A0"
}
]
},
{
"start_seconds": 680,
"end_seconds": 705,
"voiceover_text": "Suddenly, giant female scorpions ambush their home. Beth and Summer channel their heavy special time into devastating rainbow laser beams, completely incinerating the beasts. Their ridiculous narrative triumph breaks the train's thematic seal, leaving Rick and Morty celebrating.",
"keywords": [
{
"word": "scorpions",
"color": "#E63946"
},
{
"word": "rainbow",
"color": "#F72585"
},
{
"word": "incinerating",
"color": "#D90429"
},
{
"word": "celebrating",
"color": "#2A9D8F"
}
]
}
],
"target_total_duration_seconds": 60
}