{
  "video_duration_seconds": 1358,
  "title": "Part 2: Morty Finds a Way Out",
  "hashtags": [
    "#rickandmorty",
    "#morty",
    "#animation",
    "#adultswim",
    "#scifi",
    "#multiverse",
    "#storyclip"
  ],
  "youtube_tags": [
    "rick and morty",
    "morty escape",
    "morty woods scene",
    "rick and morty family",
    "rick and morty season 7",
    "rick and morty explained",
    "animated sci fi",
    "multiverse cartoon",
    "morty journal",
    "yosemite clue",
    "family drama animation",
    "short form commentary"
  ],
  "cuts": [
    {
      "start_seconds": 573,
      "end_seconds": 605,
      "voiceover_text": "Morty's new family has one solution for stopping him from running away: make him strong enough to stay. They throw him into the dark woods and leave him scrambling through the trees, while a lantern-bearing man appears behind him. Morty keeps moving, shaken but determined, until he finds a hollow and a bag. Inside is a red journal. The pages are filled with handwritten notes and directions, including one huge clue: Yosemite. This is no longer just an escape. Someone left a trail before him. Who wrote the journal, and does it lead Morty home?",
      "keywords": [
        {
          "word": "running",
          "color": "#FF5C5C"
        },
        {
          "word": "journal",
          "color": "#FFD166"
        },
        {
          "word": "Yosemite",
          "color": "#66D9EF"
        },
        {
          "word": "home",
          "color": "#8BE28B"
        }
      ]
    }
  ],
  "target_total_duration_seconds": 30,
  "series": {
    "series_id": "series-1789040069424",
    "part": 2,
    "start_seconds": 551,
    "end_seconds": 605,
    "is_final": false,
    "summary": "Morty is forced into the woods to make him strong enough to stay, where he finds a journal and a possible path home."
  }
}
