{
  "video_duration_seconds": 1416,
  "title": "Illumi Breaks Killua Before the Hunter Exam Does",
  "hashtags": [
    "#hunterxhunter",
    "#killua",
    "#illumi",
    "#hunterexam",
    "#animeedit",
    "#animeclips",
    "#anime",
    "#animemoments"
  ],
  "youtube_tags": [
    "hunter x hunter",
    "hunter x hunter 2011",
    "killua zoldyck",
    "illumi zoldyck",
    "killua vs illumi",
    "killua and illumi",
    "hunter exam",
    "killua kills bodoro",
    "bodoro death",
    "killua disqualified",
    "anime emotional scene",
    "anime betrayal",
    "anime clips",
    "anime edit",
    "hunter x hunter shorts"
  ],
  "cuts": [
    {
      "start_seconds": 870,
      "end_seconds": 936,
      "voiceover_text": "Killua finally says what he wants from life. He is tired of killing. He wants Gon as a real friend. For one second, he looks certain of it. Illumi never changes expression. He tells Killua that an assassin does not know friendship. He says Killua was raised to measure people by one question. Can he kill them? Then he turns Gon into the threat. Illumi says Gon is too bright for Killua to understand. Stay beside him long enough, he warns, and Killua will want to test himself against his own friend. Killua tries to stand firm. His fist knots at his side. But Illumi's unblinking stare starts to break that certainty.",
      "keywords": [
        {
          "word": "friend",
          "color": "#52D273"
        },
        {
          "word": "kill",
          "color": "#FF5C5C"
        },
        {
          "word": "break",
          "color": "#A879E6"
        }
      ]
    },
    {
      "start_seconds": 1104,
      "end_seconds": 1182,
      "voiceover_text": "Later, Illumi turns that warning into a test. He towers over Killua and holds one hand above him. Move, he says, and their fight begins. Even touching him is enough. Then Illumi makes the stakes cruel. If Killua refuses to fight, Gon will die. The other examinees tense behind him. They shout for Killua to strike back. Killua cannot move. He already knows he cannot defeat his older brother. Illumi keeps closing in. He reminds Killua of the lesson drilled into him since childhood. Never face someone stronger. With Gon supposedly in danger, Killua still cannot fight. At last, he admits defeat. That is when Illumi reveals the trick. He was never going to kill Gon. The threat was only a test. Illumi places a hand on Killua's head and says he has proved exactly what the family expects. Killua cannot protect a friend.",
      "keywords": [
        {
          "word": "test",
          "color": "#F6C945"
        },
        {
          "word": "die",
          "color": "#FF5C5C"
        },
        {
          "word": "defeat",
          "color": "#5C8DFF"
        }
      ]
    },
    {
      "start_seconds": 1212,
      "end_seconds": 1258,
      "voiceover_text": "After Illumi leaves, something in Killua goes quiet. His hand curls into a fist. Then he steps into the next match opposite Bodoro with no expression at all. Bodoro raises his fists and moves first. Killua does not flinch. His eyes sink into shadow. In one sudden blur, he launches forward and sends the older fighter crashing down. When the room looks back, Bodoro is on the floor. Killua stands apart with blood on his hand and across his shirt. The other examinees freeze. Killua walks through the doors alone. The committee disqualifies him for killing Bodoro.",
      "keywords": [
        {
          "word": "quiet",
          "color": "#5C8DFF"
        },
        {
          "word": "blood",
          "color": "#FF3030"
        },
        {
          "word": "disqualifies",
          "color": "#F6C945"
        }
      ]
    }
  ],
  "target_total_duration_seconds": 180
}
