{
  "video_duration_seconds": 1317,
  "title": "A Deadly Parasite Hijacks Their Memories Part 2",
  "series": {
    "series_id": "series-1789120975452",
    "part": 2,
    "start_seconds": 102,
    "end_seconds": 255,
    "is_final": false,
    "summary": "Rick seals the house to contain the parasite outbreak, but a shared elevator memory conjures Cousin Nicky into reality. When Nicky attempts to open the locked doors, Rick shoots him dead, revealing a transformed parasite and sparking family-wide paranoia that their memories are fabricated."
  },
  "hashtags": [
    "#rickandmorty",
    "#totalrickall",
    "#cousinnicky",
    "#mrpoopybutthole",
    "#scifi",
    "#animation",
    "#adultswim"
  ],
  "youtube_tags": [
    "rick and morty",
    "total rickall",
    "cousin nicky",
    "alien parasite",
    "fake memories",
    "blast shields",
    "rick locks down house",
    "rick shoots cousin nicky",
    "mr poopybutthole",
    "rick and morty clip",
    "adult swim animation",
    "scifi comedy",
    "parasite outbreak",
    "who is real"
  ],
  "cuts": [
    {
      "start_seconds": 102,
      "end_seconds": 117,
      "voiceover_text": "Rick slams the house into lockdown to trap an alien parasite, sealing every window behind blast shields. He is convinced the family is safe inside, but the monster is already in the room.",
      "keywords": [
        {
          "word": "lockdown",
          "color": "#FF9500"
        },
        {
          "word": "parasite",
          "color": "#FF3B30"
        },
        {
          "word": "monster",
          "color": "#AF52DE"
        }
      ]
    },
    {
      "start_seconds": 195,
      "end_seconds": 230,
      "voiceover_text": "Moments later, a fond elevator memory conjures Cousin Nicky straight into reality. The family embraces him, but Nicky urgently pushes everyone toward the locked exits.",
      "keywords": [
        {
          "word": "memory",
          "color": "#5AC8FA"
        },
        {
          "word": "reality",
          "color": "#34C759"
        }
      ]
    },
    {
      "start_seconds": 231,
      "end_seconds": 255,
      "voiceover_text": "Rick draws his blaster and shoots him dead. On the floor, Nicky morphs into a grotesque alien parasite. Rick counts heads: somebody here is an imposter. If every loving memory is a lie, who is actually real?",
      "keywords": [
        {
          "word": "shoots",
          "color": "#FF3B30"
        },
        {
          "word": "imposter",
          "color": "#FF9500"
        },
        {
          "word": "real",
          "color": "#FFCC00"
        }
      ]
    }
  ],
  "target_total_duration_seconds": 30
}
