{
  "version": 2,
  "job_id": "scissors-p1",
  "title": "Marco Falls For Demon Ex Traps — Part 1",
  "video_duration_seconds": 1315,
  "target_total_duration_seconds": 30,
  "hashtags": [
    "#starvstheforcesofevil",
    "#svtfoe",
    "#marcodiaz",
    "#tomlucitor",
    "#animation",
    "#cartoon"
  ],
  "youtube_tags": [
    "star vs the forces of evil",
    "svtfoe",
    "marco diaz",
    "tom lucitor",
    "mackie hand marathon",
    "disney xd",
    "star vs",
    "animated series",
    "cartoon moments",
    "marco and tom",
    "friend enemies",
    "disney animation"
  ],
  "series": {
    "series_id": "scissors",
    "part": 1,
    "start_seconds": 0,
    "end_seconds": 340,
    "is_final": false,
    "summary": "Desperate to attend the sold-out Mackie Hand movie marathon, Marco is surprised when Stars demon ex-boyfriend Tom pulls up in an extravagant carriage offering an extra ticket. Star insists it is a dangerous trap, but Tom claims he has changed his wicked ways and genuinely wants to be friends. Inside the dragon-drawn vehicle, Tom showers Marco with royal comforts and Swedish kung fu trivia, winning him over until Marco suspects a deeper motive behind Toms suspicious generosity."
  },
  "cuts": [
    {
      "start_seconds": 55,
      "end_seconds": 83,
      "voiceover_text": "Marco is having the worst day of his life. His martial arts idol Mackie Hand is dead, and the tribute marathon just sold out in seconds. He is completely devastated.",
      "keywords": [
        {
          "word": "devastated",
          "color": "#FF4444"
        }
      ]
    },
    {
      "start_seconds": 117,
      "end_seconds": 145,
      "voiceover_text": "Right when all hope seems lost, Stars demonic ex-boyfriend Tom pulls up in a blazing carriage. He flaunts two front-row tickets, promising he has given up his wicked ways just to be Marcos friend.",
      "keywords": [
        {
          "word": "demonic",
          "color": "#FF7700"
        }
      ]
    },
    {
      "start_seconds": 207,
      "end_seconds": 251,
      "voiceover_text": "Marco expects a brutal trap and grills Tom on obscure Swedish kung fu lore. Incredibly, Tom nails every single detail. Marco drops his guard, unaware that Tom is counting down the seconds to a much darker scheme.",
      "keywords": [
        {
          "word": "trap",
          "color": "#9B51E0"
        }
      ]
    }
  ]
}
