{
  "video_duration_seconds": 1380,
  "title": "Light Outplays L With A Fake Rule: Part 2",
  "series": {
    "series_id": "series-1788219142023",
    "part": 2,
    "start_seconds": 640,
    "end_seconds": 1170,
    "is_final": false,
    "summary": "The task force discovers the fake thirteen-day rule and clears Light and Misa of suspicion, allowing Light to have his handcuffs removed before sending Misa to unearth the hidden Death Note and trade half her lifespan to Ryuk for Shinigami eyes."
  },
  "hashtags": [
    "#deathnote",
    "#lightyagami",
    "#anime",
    "#animerecap",
    "#shinigami",
    "#animeedits"
  ],
  "youtube_tags": [
    "death note",
    "death note recap",
    "light yagami",
    "kira",
    "ryuzaki",
    "13 day rule",
    "death note fake rule",
    "misa amane",
    "ryuk",
    "shinigami eyes deal",
    "anime recap",
    "death note part 2",
    "anime moments"
  ],
  "cuts": [
    {
      "start_seconds": 782,
      "end_seconds": 816,
      "voiceover_text": "A single rule inside the murder notebook suddenly turns every detective completely upside down. The task force reads the instructions written on the back cover of the seized death note. According to the text, anyone who fails to write names consecutively within thirteen days will instantly die. The detectives freeze in stunned realization. Light Yagami and Misa Amane were held under constant surveillance in solitary confinement for over fifty days while executions never stopped. If this rule is genuine, neither of them could possibly be Kira. Relief washes over the room as the investigators celebrate their absolute innocence.",
      "keywords": [
        {
          "word": "notebook",
          "color": "#FF5C5C"
        },
        {
          "word": "thirteen",
          "color": "#FFA500"
        },
        {
          "word": "innocence",
          "color": "#5CE65C"
        }
      ]
    },
    {
      "start_seconds": 901,
      "end_seconds": 934,
      "voiceover_text": "With suspicion shattered, the heavy steel handcuffs linking Light to the lead detective are finally removed. Light maintains a calm, humble expression, politely asking to continue assisting the investigation as a trusted ally. L reluctantly accepts his cooperation. Beneath his composed demeanor, Light is entirely triumphant. His masterfully fabricated thirteen-day rule completely neutralized the detective’s keen intuition. L has no choice but to accept supernatural rules written by a Shinigami. Light silently gloats in the shadows, knowing his greatest rival has been hopelessly outmaneuvered. Defying the self-proclaimed god of the new world carries only one sentence, and execution draws near.",
      "keywords": [
        {
          "word": "handcuffs",
          "color": "#4A90E2"
        },
        {
          "word": "triumphant",
          "color": "#FFD700"
        },
        {
          "word": "execution",
          "color": "#FF3B30"
        }
      ]
    },
    {
      "start_seconds": 1021,
      "end_seconds": 1054,
      "voiceover_text": "Acting on secret directions whispered by Light, Misa ventures into the secluded woods and unearths the buried notebook. Touching the dark leather instantly restores all her dormant memories as Kira’s second disciple. She opens Light’s handwritten letter with trembling anticipation. His direct instructions are chillingly clear: she must write L’s real name into the Death Note to eliminate him permanently. She is ordered to tear out individual pages, rebury the notebook, and burn the incriminating letter. Light promises his lifelong devotion if she succeeds. Misa is overjoyed by his words, eager to destroy the greatest obstacle standing in their way.",
      "keywords": [
        {
          "word": "memories",
          "color": "#9B51E0"
        },
        {
          "word": "instructions",
          "color": "#E67E22"
        },
        {
          "word": "devotion",
          "color": "#FF69B4"
        }
      ]
    },
    {
      "start_seconds": 1148,
      "end_seconds": 1170,
      "voiceover_text": "Back in her private quarters, panic takes hold when Misa realizes she cannot remember the name of Light’s target. Ryuk looms over her with an ominous proposition. The Shinigami warns that trading for his supernatural eyes will slice her remaining lifespan in half for a second time. Unshaken by the deadly cost, Misa agrees without hesitation, determined to deliver the fatal blow for the man she loves.",
      "keywords": [
        {
          "word": "proposition",
          "color": "#9B51E0"
        },
        {
          "word": "lifespan",
          "color": "#FF3B30"
        },
        {
          "word": "fatal",
          "color": "#D0021B"
        }
      ]
    }
  ],
  "target_total_duration_seconds": 120
}
