{
  "video_duration_seconds": 1358,
  "series": {
    "series_id": "series-1789040069424",
    "part": 5,
    "start_seconds": 827,
    "end_seconds": 1128,
    "is_final": false,
    "summary": "Professor Sanchez breaks his sobriety to build Morty a portal home, but the foster family ambushes them before a lethal test reveals the rift is deadly."
  },
  "title": "Rick Builds A Lethal Portal Part 5",
  "hashtags": [
    "#rickandmorty",
    "#morty",
    "#portalgun",
    "#scifi",
    "#adultswim",
    "#cartoon",
    "#animation"
  ],
  "youtube_tags": [
    "rick and morty",
    "rick and morty part 5",
    "morty smith",
    "rick sanchez",
    "portal gun",
    "rick and morty season 9",
    "adult swim",
    "rick and morty clips",
    "morty trapped",
    "foster family",
    "jerry smith",
    "multiverse portal",
    "rick and morty animation",
    "field of dreams"
  ],
  "cuts": [
    {
      "start_seconds": 827,
      "end_seconds": 844,
      "voiceover_text": "Morty was trapped thousands of lightyears from home, convinced nobody was coming for him. As the boy broke down sobbing in bed, Professor Sanchez stepped inside. The retired scientist had sworn off multidimensional travel forever, but watching Morty unravel shattered his resolve. Pulling the boy into a tight hug, he promised to secretly build a portal.",
      "keywords": [
        {
          "word": "trapped",
          "color": "#FF5C5C"
        },
        {
          "word": "sobbing",
          "color": "#4A90E2"
        },
        {
          "word": "promised",
          "color": "#50E3C2"
        },
        {
          "word": "portal",
          "color": "#7ED321"
        }
      ]
    },
    {
      "start_seconds": 1105,
      "end_seconds": 1128,
      "voiceover_text": "Hours later in the garage, Rick broke his sobriety to complete the machine, only for the foster family to ambush them with a rifle. Jerry furiously confronted Rick, demanding to know if this drunken contraption had ever been tested. Rick scoffed and shoved the pet cat straight into the swirling rift. Seconds later, the creature dropped back out mutilated and lifeless. Morty recoiled in pure terror. His only way home was a death trap.",
      "keywords": [
        {
          "word": "ambush",
          "color": "#F5A623"
        },
        {
          "word": "rifle",
          "color": "#D0021B"
        },
        {
          "word": "tested",
          "color": "#F8E71C"
        },
        {
          "word": "mutilated",
          "color": "#9013FE"
        },
        {
          "word": "terror",
          "color": "#D0021B"
        }
      ]
    }
  ],
  "target_total_duration_seconds": 30
}
