{
  "video_duration_seconds": 1377,
  "title": "Light Demands His Own Arrest Part 3",
  "series": {
    "series_id": "series-1788189537972",
    "part": 3,
    "start_seconds": 1264,
    "end_seconds": 1285,
    "is_final": false,
    "summary": "Light turns himself into L and demands solitary confinement to execute a daring counter-gamble after Rem threatens his life."
  },
  "hashtags": [
    "#deathnote",
    "#lightyagami",
    "#kira",
    "#anime",
    "#animemoments",
    "#animetwt"
  ],
  "youtube_tags": [
    "death note",
    "death note part 3",
    "light yagami",
    "light turns himself in",
    "light and l",
    "kira",
    "rem death note",
    "death note episode 16",
    "anime",
    "anime edits",
    "psychological thriller",
    "shinigami",
    "death note suspense",
    "anime clips"
  ],
  "cuts": [
    {
      "start_seconds": 1264,
      "end_seconds": 1285,
      "voiceover_text": "Facing execution from a Shinigami, Light Yagami makes an unthinkable move. Rem promises to kill him if Misa dies in confinement. Trapped between L's investigation and a Death God's blade, Light refuses to panic. Instead, he turns to Ryuk with a chilling farewell. Light walks straight into police custody and demands to be locked in a cell. L locks the heavy doors shut. Light is trapped. Or is this the trap?",
      "keywords": [
        {
          "word": "execution",
          "color": "#E53E3E"
        },
        {
          "word": "confinement",
          "color": "#3182CE"
        },
        {
          "word": "farewell",
          "color": "#DD6B20"
        },
        {
          "word": "trap",
          "color": "#805AD5"
        }
      ]
    }
  ],
  "target_total_duration_seconds": 120
}
